{
  "candidate_version": "0",
  "candidate_id": "AEC-M7R0-001",
  "authority_target": "blueprint_automation_material",
  "source": {
    "project_id": "P-M7R0",
    "revision_id": "rev-001",
    "blueprint_sha256": "aaaaaaaaaaaaaaaaaaaaaaaaaaaaaaaaaaaaaaaaaaaaaaaaaaaaaaaaaaaaaaaa",
    "automation_material_sha256": "bbbbbbbbbbbbbbbbbbbbbbbbbbbbbbbbbbbbbbbbbbbbbbbbbbbbbbbbbbbbbbbb"
  },
  "actor": {
    "kind": "user",
    "actor_id": "local-user"
  },
  "reason": "Raise the synth cutoff point without changing lane identity.",
  "operations": [
    {
      "operation_id": "OP-M7R0-001",
      "op": "SET_VALUE",
      "target": {
        "lane_id": "B-SYNTH-CUTOFF",
        "point_id": "P-CUTOFF-001"
      },
      "value": 1200.0
    }
  ],
  "preview_only": true
}
